{
  "$schema": "https://json-schema.org/draft/2020-12/schema",
  "$id": "https://lima.dev/schema/conformance-case.schema.json",
  "title": "Lima conformance corpus case",
  "type": "object",
  "additionalProperties": false,
  "required": [
    "id",
    "spec",
    "section",
    "description",
    "expect"
  ],
  "properties": {
    "id": {
      "type": "string",
      "pattern": "^(core|references|references-2)(\\.[a-z0-9][a-z0-9-]*){2,}$"
    },
    "spec": {
      "enum": [
        "core",
        "references"
      ]
    },
    "specVersion": {
      "description": "Normative specification version. Legacy cases without this field are References/Core 1.0; every newly versioned suite must set it explicitly.",
      "enum": ["1.0", "1.1", "2.0"]
    },
    "api": {
      "description": "Which entry point to run. Legacy 1.0 cases default to references; References 2.0 cases default to parse. Use core for parseCore and references only for the deprecated parseReferences compatibility alias.",
      "enum": [
        "core",
        "parse",
        "references"
      ]
    },
    "section": {
      "type": "string",
      "minLength": 1
    },
    "description": {
      "type": "string",
      "minLength": 1
    },
    "input": {
      "type": "string"
    },
    "inputFile": {
      "type": "string",
      "pattern": "^[^/]+\\.(lima|bin)$"
    },
    "options": {
      "$ref": "#/$defs/options"
    },
    "generator": {
      "$ref": "#/$defs/generator"
    },
    "expect": {
      "$ref": "#/$defs/expectation"
    },
    "tags": {
      "type": "array",
      "items": {
        "type": "string",
        "pattern": "^[a-z0-9][a-z0-9-]*$"
      },
      "uniqueItems": true
    },
    "notes": {
      "type": "string"
    }
  },
  "allOf": [
    {
      "oneOf": [
        {
          "required": [
            "inputFile"
          ]
        },
        {
          "required": [
            "input"
          ]
        },
        {
          "required": [
            "generator"
          ]
        }
      ]
    },
    {
      "not": {
        "anyOf": [
          {
            "required": [
              "input",
              "inputFile"
            ]
          },
          {
            "required": [
              "input",
              "generator"
            ]
          },
          {
            "required": [
              "inputFile",
              "generator"
            ]
          }
        ]
      }
    }
  ],
  "$defs": {
    "options": {
      "type": "object",
      "additionalProperties": false,
      "properties": {
        "strict": {
          "type": "boolean",
          "default": false
        },
        "mode": {
          "enum": [
            "core",
            "references"
          ],
          "default": "references"
        },
        "partials": {
          "type": "object",
          "additionalProperties": {
            "$ref": "#/$defs/corpusValue"
          }
        }
      }
    },
    "generator": {
      "type": "object",
      "additionalProperties": false,
      "required": [
        "name",
        "parameters"
      ],
      "properties": {
        "name": {
          "enum": [
            "document-bytes",
            "repeated-key",
            "repeated-scalar",
            "nested-mappings",
            "partial-count",
            "partial-node-tree",
            "result-node-expansion"
          ]
        },
        "parameters": {
          "type": "object",
          "additionalProperties": true
        }
      }
    },
    "expectation": {
      "type": "object",
      "additionalProperties": false,
      "properties": {
        "result": {
          "$ref": "#/$defs/corpusValue"
        },
        "error": {
          "$ref": "#/$defs/diagnostic"
        },
        "warnings": {
          "type": "array",
          "items": {
            "$ref": "#/$defs/diagnostic"
          },
          "default": []
        }
      },
      "oneOf": [
        {
          "required": [
            "result"
          ]
        },
        {
          "required": [
            "error"
          ]
        }
      ]
    },
    "diagnostic": {
      "type": "object",
      "additionalProperties": false,
      "required": [
        "code"
      ],
      "properties": {
        "line": {
          "type": "integer",
          "minimum": 1
        },
        "column": {
          "type": "integer",
          "minimum": 1
        },
        "token": {
          "type": "string"
        },
        "key": {
          "type": "string"
        },
        "partial": {
          "type": "string"
        },
        "path": {
          "type": "string"
        },
        "contains": {
          "type": "string"
        },
        "code": {
          "enum": [
            "INVALID_ESCAPE",
            "INVALID_QUOTE",
            "INVALID_DATE",
            "INVALID_NUMBER",
            "INVALID_REFERENCE_SHAPE",
            "INVALID_INDENTATION",
            "UNRECOGNIZED_LINE",
            "INVALID_FLOW_SYNTAX",
            "DUPLICATE_KEY",
            "RESOURCE_LIMIT",
            "UNRESOLVED_REFERENCE",
            "INVALID_INTERPOLATION",
            "INVALID_PARTIAL"
          ]
        }
      }
    },
    "corpusValue": {
      "oneOf": [
        {
          "type": "null"
        },
        {
          "type": "boolean"
        },
        {
          "type": "number"
        },
        {
          "type": "string"
        },
        {
          "type": "array",
          "items": {
            "$ref": "#/$defs/corpusValue"
          }
        },
        {
          "type": "object",
          "required": [
            "$type",
            "value"
          ],
          "additionalProperties": false,
          "properties": {
            "$type": {
              "const": "instant"
            },
            "value": {
              "type": "string",
              "pattern": "^[0-9]{4}-[0-9]{2}-[0-9]{2}T[0-9]{2}:[0-9]{2}:[0-9]{2}Z$"
            }
          }
        },
        {
          "type": "object",
          "required": [
            "$type",
            "value"
          ],
          "additionalProperties": false,
          "properties": {
            "$type": {
              "const": "int"
            },
            "value": {
              "type": "integer"
            }
          }
        },
        {
          "type": "object",
          "required": [
            "$type",
            "value"
          ],
          "additionalProperties": false,
          "properties": {
            "$type": {
              "const": "float"
            },
            "value": {
              "type": "number"
            }
          }
        },
        {
          "type": "object",
          "required": [
            "$type",
            "value"
          ],
          "additionalProperties": false,
          "properties": {
            "$type": {
              "const": "host-number"
            },
            "value": {
              "enum": [
                "nan",
                "infinity",
                "-infinity",
                "-0"
              ]
            }
          }
        },
        {
          "type": "object",
          "required": [
            "$type",
            "value"
          ],
          "additionalProperties": false,
          "properties": {
            "$type": {
              "const": "host-date"
            },
            "value": {
              "enum": [
                "invalid",
                "year-underflow",
                "year-overflow"
              ]
            }
          }
        },
        {
          "type": "object",
          "propertyNames": {
            "not": {
              "const": "$type"
            }
          },
          "additionalProperties": {
            "$ref": "#/$defs/corpusValue"
          }
        }
      ]
    }
  }
}
