{
  "id": "core.limits.key-length.decoded-quoted",
  "spec": "core",
  "section": "9",
  "description": "A double-quoted key's length is measured after escape decoding, not on the raw source text: 128 \\\\u0041 escapes (768 raw characters) decode to 128 'A' code points and are allowed.",
  "input": "\"\\u0041\\u0041\\u0041\\u0041\\u0041\\u0041\\u0041\\u0041\\u0041\\u0041\\u0041\\u0041\\u0041\\u0041\\u0041\\u0041\\u0041\\u0041\\u0041\\u0041\\u0041\\u0041\\u0041\\u0041\\u0041\\u0041\\u0041\\u0041\\u0041\\u0041\\u0041\\u0041\\u0041\\u0041\\u0041\\u0041\\u0041\\u0041\\u0041\\u0041\\u0041\\u0041\\u0041\\u0041\\u0041\\u0041\\u0041\\u0041\\u0041\\u0041\\u0041\\u0041\\u0041\\u0041\\u0041\\u0041\\u0041\\u0041\\u0041\\u0041\\u0041\\u0041\\u0041\\u0041\\u0041\\u0041\\u0041\\u0041\\u0041\\u0041\\u0041\\u0041\\u0041\\u0041\\u0041\\u0041\\u0041\\u0041\\u0041\\u0041\\u0041\\u0041\\u0041\\u0041\\u0041\\u0041\\u0041\\u0041\\u0041\\u0041\\u0041\\u0041\\u0041\\u0041\\u0041\\u0041\\u0041\\u0041\\u0041\\u0041\\u0041\\u0041\\u0041\\u0041\\u0041\\u0041\\u0041\\u0041\\u0041\\u0041\\u0041\\u0041\\u0041\\u0041\\u0041\\u0041\\u0041\\u0041\\u0041\\u0041\\u0041\\u0041\\u0041\\u0041\\u0041\\u0041\\u0041\\u0041\": v",
  "expect": {
    "result": {
      "AAAAAAAAAAAAAAAAAAAAAAAAAAAAAAAAAAAAAAAAAAAAAAAAAAAAAAAAAAAAAAAAAAAAAAAAAAAAAAAAAAAAAAAAAAAAAAAAAAAAAAAAAAAAAAAAAAAAAAAAAAAAAAAA": "v"
    }
  },
  "tags": [
    "limit",
    "boundary"
  ]
}
