{
  "id": "core.flow-sequence.empty-element.strict",
  "spec": "core",
  "section": "7.4",
  "description": "A leading or consecutive comma (empty element) throws in strict mode.",
  "input": "a: [, x]",
  "options": { "strict": true },
  "expect": {
    "error": {
      "line": 1,
      "code": "INVALID_FLOW_SYNTAX"
    }
  },
  "tags": ["strict", "error", "flow-sequence"]
}
